,0,1,2,3,4,5
1,,,,,,
2,"['Monitor whether default accounts have been activated or logged into. These audits should also include checks on any appliances and applications for default credentials or SSH keys, and if any are discovered, they should be updated immediately.']","['Monitor whether default accounts have been activated or logged into. These audits should also include checks on any appliances and applications for default credentials or SSH keys, and if any are discovered, they should be updated immediately.']","['Monitor whether default accounts have been activated or logged into. These audits should also include checks on any appliances and applications for default credentials or SSH keys, and if any are discovered, they should be updated immediately.']","['Monitor whether default accounts have been activated or logged into. These audits should also include checks on any appliances and applications for default credentials or SSH keys, and if any are discovered, they should be updated immediately.']","['Monitor whether default accounts have been activated or logged into. These audits should also include checks on any appliances and applications for default credentials or SSH keys, and if any are discovered, they should be updated immediately.']","['Monitor whether default accounts have been activated or logged into. These audits should also include checks on any appliances and applications for default credentials or SSH keys, and if any are discovered, they should be updated immediately.']"
3,"[""Command-line and scripting activities can be captured through proper logging of process execution with command-line arguments. This information can be useful in gaining additional insight to adversaries' actions through how they use native processes or custom tools. Also monitor for loading of modules associated with specific languages.\n\nIf scripting is restricted for normal users, then any attempt to enable scripts running on a system would be considered suspicious. If scripts are not commonly used on a system, but enabled, scripts running out of cycle from patching or other administrator functions are suspicious. Scripts should be captured from the file system when possible to determine their actions and intent.\n\nScripts are likely to perform actions with various effects on a system that may generate events, depending on the types of monitoring used. Monitor processes and command-line arguments for script execution and subsequent behavior. Actions may be related to network and system information discovery, collection, or other scriptable post-compromise behaviors and could be used as indicators of detection leading back to the source script."", 'Consider reviewing command history in either the console or as part of the running memory to determine if unauthorized or suspicious commands were used to modify device configuration.(Citation: Cisco IOS Software Integrity Assurance - Command History)\n\nConsider comparing a copy of the network device configuration against a known-good version to discover unauthorized changes to the command interpreter. The same process can be accomplished through a comparison of the run-time memory, though this is non-trivial and may require assistance from the vendor.', ""Monitor the execution of and command-line arguments for applications that may be used by an adversary to gain Initial Access that require user interaction. This includes compression applications, such as those for zip files, that can be used to [Deobfuscate/Decode Files or Information](https://attack.mitre.org/techniques/T1140) in payloads.\n\nAnti-virus can potentially detect malicious documents and files that are downloaded and executed on the user's computer. Endpoint sensing or network sensing can potentially detect malicious events once the file is opened (such as a Microsoft Word document or PDF reaching out to the internet or spawning powershell.exe)."", 'Monitor the local image registry to make sure malicious images are not added. Track the deployment of new containers, especially from newly built images. Monitor the behavior of containers within the environment to detect anomalous behavior or malicious activity after users deploy from malicious images.']","[""Command-line and scripting activities can be captured through proper logging of process execution with command-line arguments. This information can be useful in gaining additional insight to adversaries' actions through how they use native processes or custom tools. Also monitor for loading of modules associated with specific languages.\n\nIf scripting is restricted for normal users, then any attempt to enable scripts running on a system would be considered suspicious. If scripts are not commonly used on a system, but enabled, scripts running out of cycle from patching or other administrator functions are suspicious. Scripts should be captured from the file system when possible to determine their actions and intent.\n\nScripts are likely to perform actions with various effects on a system that may generate events, depending on the types of monitoring used. Monitor processes and command-line arguments for script execution and subsequent behavior. Actions may be related to network and system information discovery, collection, or other scriptable post-compromise behaviors and could be used as indicators of detection leading back to the source script."", 'Consider reviewing command history in either the console or as part of the running memory to determine if unauthorized or suspicious commands were used to modify device configuration.(Citation: Cisco IOS Software Integrity Assurance - Command History)\n\nConsider comparing a copy of the network device configuration against a known-good version to discover unauthorized changes to the command interpreter. The same process can be accomplished through a comparison of the run-time memory, though this is non-trivial and may require assistance from the vendor.', ""Monitor the execution of and command-line arguments for applications that may be used by an adversary to gain Initial Access that require user interaction. This includes compression applications, such as those for zip files, that can be used to [Deobfuscate/Decode Files or Information](https://attack.mitre.org/techniques/T1140) in payloads.\n\nAnti-virus can potentially detect malicious documents and files that are downloaded and executed on the user's computer. Endpoint sensing or network sensing can potentially detect malicious events once the file is opened (such as a Microsoft Word document or PDF reaching out to the internet or spawning powershell.exe)."", 'Monitor the local image registry to make sure malicious images are not added. Track the deployment of new containers, especially from newly built images. Monitor the behavior of containers within the environment to detect anomalous behavior or malicious activity after users deploy from malicious images.']","[""Command-line and scripting activities can be captured through proper logging of process execution with command-line arguments. This information can be useful in gaining additional insight to adversaries' actions through how they use native processes or custom tools. Also monitor for loading of modules associated with specific languages.\n\nIf scripting is restricted for normal users, then any attempt to enable scripts running on a system would be considered suspicious. If scripts are not commonly used on a system, but enabled, scripts running out of cycle from patching or other administrator functions are suspicious. Scripts should be captured from the file system when possible to determine their actions and intent.\n\nScripts are likely to perform actions with various effects on a system that may generate events, depending on the types of monitoring used. Monitor processes and command-line arguments for script execution and subsequent behavior. Actions may be related to network and system information discovery, collection, or other scriptable post-compromise behaviors and could be used as indicators of detection leading back to the source script."", 'Consider reviewing command history in either the console or as part of the running memory to determine if unauthorized or suspicious commands were used to modify device configuration.(Citation: Cisco IOS Software Integrity Assurance - Command History)\n\nConsider comparing a copy of the network device configuration against a known-good version to discover unauthorized changes to the command interpreter. The same process can be accomplished through a comparison of the run-time memory, though this is non-trivial and may require assistance from the vendor.', ""Monitor the execution of and command-line arguments for applications that may be used by an adversary to gain Initial Access that require user interaction. This includes compression applications, such as those for zip files, that can be used to [Deobfuscate/Decode Files or Information](https://attack.mitre.org/techniques/T1140) in payloads.\n\nAnti-virus can potentially detect malicious documents and files that are downloaded and executed on the user's computer. Endpoint sensing or network sensing can potentially detect malicious events once the file is opened (such as a Microsoft Word document or PDF reaching out to the internet or spawning powershell.exe)."", 'Monitor the local image registry to make sure malicious images are not added. Track the deployment of new containers, especially from newly built images. Monitor the behavior of containers within the environment to detect anomalous behavior or malicious activity after users deploy from malicious images.']","[""Command-line and scripting activities can be captured through proper logging of process execution with command-line arguments. This information can be useful in gaining additional insight to adversaries' actions through how they use native processes or custom tools. Also monitor for loading of modules associated with specific languages.\n\nIf scripting is restricted for normal users, then any attempt to enable scripts running on a system would be considered suspicious. If scripts are not commonly used on a system, but enabled, scripts running out of cycle from patching or other administrator functions are suspicious. Scripts should be captured from the file system when possible to determine their actions and intent.\n\nScripts are likely to perform actions with various effects on a system that may generate events, depending on the types of monitoring used. Monitor processes and command-line arguments for script execution and subsequent behavior. Actions may be related to network and system information discovery, collection, or other scriptable post-compromise behaviors and could be used as indicators of detection leading back to the source script."", 'Consider reviewing command history in either the console or as part of the running memory to determine if unauthorized or suspicious commands were used to modify device configuration.(Citation: Cisco IOS Software Integrity Assurance - Command History)\n\nConsider comparing a copy of the network device configuration against a known-good version to discover unauthorized changes to the command interpreter. The same process can be accomplished through a comparison of the run-time memory, though this is non-trivial and may require assistance from the vendor.', ""Monitor the execution of and command-line arguments for applications that may be used by an adversary to gain Initial Access that require user interaction. This includes compression applications, such as those for zip files, that can be used to [Deobfuscate/Decode Files or Information](https://attack.mitre.org/techniques/T1140) in payloads.\n\nAnti-virus can potentially detect malicious documents and files that are downloaded and executed on the user's computer. Endpoint sensing or network sensing can potentially detect malicious events once the file is opened (such as a Microsoft Word document or PDF reaching out to the internet or spawning powershell.exe)."", 'Monitor the local image registry to make sure malicious images are not added. Track the deployment of new containers, especially from newly built images. Monitor the behavior of containers within the environment to detect anomalous behavior or malicious activity after users deploy from malicious images.']","[""Command-line and scripting activities can be captured through proper logging of process execution with command-line arguments. This information can be useful in gaining additional insight to adversaries' actions through how they use native processes or custom tools. Also monitor for loading of modules associated with specific languages.\n\nIf scripting is restricted for normal users, then any attempt to enable scripts running on a system would be considered suspicious. If scripts are not commonly used on a system, but enabled, scripts running out of cycle from patching or other administrator functions are suspicious. Scripts should be captured from the file system when possible to determine their actions and intent.\n\nScripts are likely to perform actions with various effects on a system that may generate events, depending on the types of monitoring used. Monitor processes and command-line arguments for script execution and subsequent behavior. Actions may be related to network and system information discovery, collection, or other scriptable post-compromise behaviors and could be used as indicators of detection leading back to the source script."", 'Consider reviewing command history in either the console or as part of the running memory to determine if unauthorized or suspicious commands were used to modify device configuration.(Citation: Cisco IOS Software Integrity Assurance - Command History)\n\nConsider comparing a copy of the network device configuration against a known-good version to discover unauthorized changes to the command interpreter. The same process can be accomplished through a comparison of the run-time memory, though this is non-trivial and may require assistance from the vendor.', ""Monitor the execution of and command-line arguments for applications that may be used by an adversary to gain Initial Access that require user interaction. This includes compression applications, such as those for zip files, that can be used to [Deobfuscate/Decode Files or Information](https://attack.mitre.org/techniques/T1140) in payloads.\n\nAnti-virus can potentially detect malicious documents and files that are downloaded and executed on the user's computer. Endpoint sensing or network sensing can potentially detect malicious events once the file is opened (such as a Microsoft Word document or PDF reaching out to the internet or spawning powershell.exe)."", 'Monitor the local image registry to make sure malicious images are not added. Track the deployment of new containers, especially from newly built images. Monitor the behavior of containers within the environment to detect anomalous behavior or malicious activity after users deploy from malicious images.']","[""Command-line and scripting activities can be captured through proper logging of process execution with command-line arguments. This information can be useful in gaining additional insight to adversaries' actions through how they use native processes or custom tools. Also monitor for loading of modules associated with specific languages.\n\nIf scripting is restricted for normal users, then any attempt to enable scripts running on a system would be considered suspicious. If scripts are not commonly used on a system, but enabled, scripts running out of cycle from patching or other administrator functions are suspicious. Scripts should be captured from the file system when possible to determine their actions and intent.\n\nScripts are likely to perform actions with various effects on a system that may generate events, depending on the types of monitoring used. Monitor processes and command-line arguments for script execution and subsequent behavior. Actions may be related to network and system information discovery, collection, or other scriptable post-compromise behaviors and could be used as indicators of detection leading back to the source script."", 'Consider reviewing command history in either the console or as part of the running memory to determine if unauthorized or suspicious commands were used to modify device configuration.(Citation: Cisco IOS Software Integrity Assurance - Command History)\n\nConsider comparing a copy of the network device configuration against a known-good version to discover unauthorized changes to the command interpreter. The same process can be accomplished through a comparison of the run-time memory, though this is non-trivial and may require assistance from the vendor.', ""Monitor the execution of and command-line arguments for applications that may be used by an adversary to gain Initial Access that require user interaction. This includes compression applications, such as those for zip files, that can be used to [Deobfuscate/Decode Files or Information](https://attack.mitre.org/techniques/T1140) in payloads.\n\nAnti-virus can potentially detect malicious documents and files that are downloaded and executed on the user's computer. Endpoint sensing or network sensing can potentially detect malicious events once the file is opened (such as a Microsoft Word document or PDF reaching out to the internet or spawning powershell.exe)."", 'Monitor the local image registry to make sure malicious images are not added. Track the deployment of new containers, especially from newly built images. Monitor the behavior of containers within the environment to detect anomalous behavior or malicious activity after users deploy from malicious images.']"
4,"['Monitor whether default accounts have been activated or logged into. These audits should also include checks on any appliances and applications for default credentials or SSH keys, and if any are discovered, they should be updated immediately.']","['Monitor whether default accounts have been activated or logged into. These audits should also include checks on any appliances and applications for default credentials or SSH keys, and if any are discovered, they should be updated immediately.']","['Monitor whether default accounts have been activated or logged into. These audits should also include checks on any appliances and applications for default credentials or SSH keys, and if any are discovered, they should be updated immediately.']","['Monitor whether default accounts have been activated or logged into. These audits should also include checks on any appliances and applications for default credentials or SSH keys, and if any are discovered, they should be updated immediately.']","['Monitor whether default accounts have been activated or logged into. These audits should also include checks on any appliances and applications for default credentials or SSH keys, and if any are discovered, they should be updated immediately.']","['Monitor whether default accounts have been activated or logged into. These audits should also include checks on any appliances and applications for default credentials or SSH keys, and if any are discovered, they should be updated immediately.']"
5,"['Monitor whether default accounts have been activated or logged into. These audits should also include checks on any appliances and applications for default credentials or SSH keys, and if any are discovered, they should be updated immediately.']","['Monitor whether default accounts have been activated or logged into. These audits should also include checks on any appliances and applications for default credentials or SSH keys, and if any are discovered, they should be updated immediately.']","['Monitor whether default accounts have been activated or logged into. These audits should also include checks on any appliances and applications for default credentials or SSH keys, and if any are discovered, they should be updated immediately.']","['Monitor whether default accounts have been activated or logged into. These audits should also include checks on any appliances and applications for default credentials or SSH keys, and if any are discovered, they should be updated immediately.']","['Monitor whether default accounts have been activated or logged into. These audits should also include checks on any appliances and applications for default credentials or SSH keys, and if any are discovered, they should be updated immediately.']","['Monitor whether default accounts have been activated or logged into. These audits should also include checks on any appliances and applications for default credentials or SSH keys, and if any are discovered, they should be updated immediately.']"
6,"['Monitor whether default accounts have been activated or logged into. These audits should also include checks on any appliances and applications for default credentials or SSH keys, and if any are discovered, they should be updated immediately.']","['Monitor whether default accounts have been activated or logged into. These audits should also include checks on any appliances and applications for default credentials or SSH keys, and if any are discovered, they should be updated immediately.']","['Monitor whether default accounts have been activated or logged into. These audits should also include checks on any appliances and applications for default credentials or SSH keys, and if any are discovered, they should be updated immediately.']","['Monitor whether default accounts have been activated or logged into. These audits should also include checks on any appliances and applications for default credentials or SSH keys, and if any are discovered, they should be updated immediately.']","['Monitor whether default accounts have been activated or logged into. These audits should also include checks on any appliances and applications for default credentials or SSH keys, and if any are discovered, they should be updated immediately.']","['Monitor whether default accounts have been activated or logged into. These audits should also include checks on any appliances and applications for default credentials or SSH keys, and if any are discovered, they should be updated immediately.']"
